{
  "apiVersion": "quanyu.ai/process-handle/v1alpha1",
  "kind": "ProcessHandle",
  "adapter": { "kind": "pm2", "version": "7.0.1", "instanceId": "123e4567-e89b-42d3-a456-426614174000" },
  "identity": {
    "environmentId": "example-demo",
    "serviceId": "example-web",
    "namespace": "release-manager-demo",
    "adapterId": "42",
    "pid": 12345,
    "processStartId": "linux-proc-start-123456"
  },
  "runtime": {
    "executable": "/var/lib/example/releases/example-app/aaaaaaaaaaaaaaaaaaaaaaaaaaaaaaaaaaaaaaaa/apps/web/node_modules/next/dist/bin/next",
    "args": ["start"],
    "cwd": "/var/lib/example/releases/example-app/aaaaaaaaaaaaaaaaaaaaaaaaaaaaaaaaaaaaaaaa/apps/web"
  },
  "releaseSha": "aaaaaaaaaaaaaaaaaaaaaaaaaaaaaaaaaaaaaaaa",
  "invocationFingerprint": "sha256:bbbbbbbbbbbbbbbbbbbbbbbbbbbbbbbbbbbbbbbbbbbbbbbbbbbbbbbbbbbbbbbb",
  "provenance": {
    "origin": "started",
    "observationId": "123e4567-e89b-42d3-a456-426614174001",
    "observedAt": "2026-09-23T14:00:00Z",
    "adapterReceipt": "pm2-start-receipt-42"
  }
}
